{
  "$schema": "https://json-schema.org/draft/2020-12/schema",
  "$id": "urn:kinotch:gesture-ime:profile:v2",
  "title": "Gesture IME ProfileBundle v2",
  "type": "object",
  "required": [
    "schema",
    "id",
    "name",
    "version",
    "gesturePolicy",
    "keyDefinitions",
    "layouts",
    "layers",
    "boards",
    "entryPoints",
    "macros"
  ],
  "properties": {
    "schema": {
      "const": "gesture-ime.profile.v2"
    },
    "id": {
      "$ref": "#/$defs/id"
    },
    "name": {
      "type": "string",
      "minLength": 1,
      "maxLength": 128
    },
    "version": {
      "type": "integer",
      "minimum": 1
    },
    "gesturePolicy": {
      "$ref": "#/$defs/gesturePolicy"
    },
    "keyDefinitions": {
      "type": "array",
      "maxItems": 256,
      "items": {
        "$ref": "#/$defs/keyDefinition"
      }
    },
    "layouts": {
      "type": "array",
      "maxItems": 32,
      "items": {
        "$ref": "#/$defs/layout"
      }
    },
    "layers": {
      "type": "array",
      "maxItems": 32,
      "items": {
        "$ref": "#/$defs/layer"
      }
    },
    "boards": {
      "type": "array",
      "maxItems": 1024,
      "items": {
        "$ref": "#/$defs/board"
      }
    },
    "entryPoints": {
      "type": "array",
      "maxItems": 1024,
      "items": {
        "$ref": "#/$defs/entryPoint"
      }
    },
    "macros": {
      "type": "array",
      "maxItems": 128,
      "items": {
        "$ref": "#/$defs/macro"
      }
    },
    "theme": {
      "type": "object"
    }
  },
  "additionalProperties": true,
  "$defs": {
    "id": {
      "type": "string",
      "pattern": "^[A-Za-z0-9][A-Za-z0-9._-]{0,127}$"
    },
    "presentation": {
      "type": "object",
      "properties": {
        "text": {
          "type": "string",
          "maxLength": 256
        },
        "accessibilityLabel": {
          "type": "string",
          "maxLength": 256
        }
      },
      "additionalProperties": true
    },
    "actionInvocation": {
      "type": "object",
      "required": [
        "actionID",
        "arguments"
      ],
      "properties": {
        "actionID": {
          "type": "string",
          "pattern": "^[A-Za-z0-9][A-Za-z0-9._-]{0,127}$"
        },
        "arguments": {
          "type": "object"
        }
      },
      "additionalProperties": true
    },
    "gesturePolicy": {
      "type": "object",
      "required": [
        "deadZone",
        "initialCellCommitDistance",
        "subsequentCellCommitDistance",
        "angularHysteresisDegrees"
      ],
      "properties": {
        "deadZone": {
          "type": "number",
          "minimum": 0,
          "maximum": 2
        },
        "initialCellCommitDistance": {
          "type": "number",
          "exclusiveMinimum": 0,
          "maximum": 4
        },
        "subsequentCellCommitDistance": {
          "type": "number",
          "exclusiveMinimum": 0,
          "maximum": 4
        },
        "angularHysteresisDegrees": {
          "type": "number",
          "minimum": 0,
          "exclusiveMaximum": 45
        }
      },
      "additionalProperties": true
    },
    "coordinate": {
      "type": "object",
      "required": [
        "x",
        "y"
      ],
      "properties": {
        "x": {
          "type": "integer",
          "minimum": -32,
          "maximum": 32
        },
        "y": {
          "type": "integer",
          "minimum": -32,
          "maximum": 32
        }
      },
      "additionalProperties": false
    },
    "transition": {
      "type": "object",
      "required": [
        "targetBoardRef",
        "lifetime"
      ],
      "properties": {
        "targetBoardRef": {
          "$ref": "#/$defs/id"
        },
        "lifetime": {
          "enum": [
            "persistent",
            "transient"
          ]
        }
      },
      "additionalProperties": true
    },
    "boardEntry": {
      "type": "object",
      "required": [
        "coordinate"
      ],
      "properties": {
        "coordinate": {
          "$ref": "#/$defs/coordinate"
        },
        "presentation": {
          "$ref": "#/$defs/presentation"
        },
        "onRelease": {
          "type": "array",
          "maxItems": 16,
          "items": {
            "$ref": "#/$defs/actionInvocation"
          }
        },
        "transition": {
          "$ref": "#/$defs/transition"
        }
      },
      "anyOf": [
        {
          "required": [
            "presentation"
          ]
        },
        {
          "required": [
            "onRelease"
          ]
        },
        {
          "required": [
            "transition"
          ]
        }
      ],
      "additionalProperties": true
    },
    "boardTrigger": {
      "type": "object",
      "required": [
        "type",
        "transition"
      ],
      "properties": {
        "type": {
          "const": "hold"
        },
        "delayMs": {
          "type": "integer",
          "minimum": 50,
          "maximum": 5000
        },
        "transition": {
          "$ref": "#/$defs/transition"
        }
      },
      "additionalProperties": true
    },
    "selectionPolicy": {
      "type": "object",
      "required": [
        "kind"
      ],
      "properties": {
        "kind": {
          "const": "relativeCoordinate"
        }
      },
      "additionalProperties": true
    },
    "board": {
      "type": "object",
      "required": [
        "id",
        "selectionPolicy",
        "entries"
      ],
      "properties": {
        "id": {
          "$ref": "#/$defs/id"
        },
        "selectionPolicy": {
          "$ref": "#/$defs/selectionPolicy"
        },
        "entries": {
          "type": "array",
          "maxItems": 256,
          "items": {
            "$ref": "#/$defs/boardEntry"
          }
        },
        "triggers": {
          "type": "array",
          "maxItems": 16,
          "items": {
            "$ref": "#/$defs/boardTrigger"
          }
        }
      },
      "additionalProperties": true
    },
    "entryPoint": {
      "type": "object",
      "required": [
        "id",
        "layerID",
        "keyID",
        "trigger",
        "boardRef"
      ],
      "properties": {
        "id": {
          "$ref": "#/$defs/id"
        },
        "layerID": {
          "$ref": "#/$defs/id"
        },
        "keyID": {
          "$ref": "#/$defs/id"
        },
        "trigger": {
          "const": "press"
        },
        "boardRef": {
          "$ref": "#/$defs/id"
        }
      },
      "additionalProperties": true
    },
    "keyDefinition": {
      "type": "object",
      "required": [
        "id"
      ],
      "properties": {
        "id": {
          "$ref": "#/$defs/id"
        },
        "presentation": {
          "$ref": "#/$defs/presentation"
        },
        "role": {
          "type": "string",
          "maxLength": 64
        }
      },
      "additionalProperties": true
    },
    "placement": {
      "type": "object",
      "required": [
        "keyID",
        "row",
        "column"
      ],
      "properties": {
        "keyID": {
          "$ref": "#/$defs/id"
        },
        "row": {
          "type": "integer",
          "minimum": 0,
          "maximum": 255
        },
        "column": {
          "type": "integer",
          "minimum": 0,
          "maximum": 255
        },
        "width": {
          "type": "number",
          "exclusiveMinimum": 0,
          "maximum": 32
        },
        "height": {
          "type": "number",
          "exclusiveMinimum": 0,
          "maximum": 32
        }
      },
      "additionalProperties": true
    },
    "layout": {
      "type": "object",
      "required": [
        "id",
        "placements"
      ],
      "properties": {
        "id": {
          "$ref": "#/$defs/id"
        },
        "placements": {
          "type": "array",
          "maxItems": 256,
          "items": {
            "$ref": "#/$defs/placement"
          }
        }
      },
      "additionalProperties": true
    },
    "layer": {
      "type": "object",
      "required": [
        "id",
        "layoutRef"
      ],
      "properties": {
        "id": {
          "$ref": "#/$defs/id"
        },
        "layoutRef": {
          "$ref": "#/$defs/id"
        }
      },
      "additionalProperties": true
    },
    "macro": {
      "type": "object",
      "required": [
        "id",
        "actions"
      ],
      "properties": {
        "id": {
          "$ref": "#/$defs/id"
        },
        "actions": {
          "type": "array",
          "maxItems": 32,
          "items": {
            "$ref": "#/$defs/actionInvocation"
          }
        }
      },
      "additionalProperties": true
    }
  }
}
